hard_text,profession,gender
"He has been with the firm for seventeen years. Tapiwa is also the Partner in charge of the Deloitte Bulawayo office. Tapiwa is a business rescue practitioner, and helps businesses to return to profitability through management improvement and business re-engineering as may be deemed appropriate. He is the former Chairperson of the Matabeleland Society of Chartered Accountants Committee and also a member of the Council of the Institute of Chartered Accountants in Zimbabwe (ICAZ).",accountant,Male
"A conviction that organisations could do considerably, and sustainably, better if people were better managed led him to write his first book, “Lean Organisations Need FAT People” and to found his company, Zealise Limited and develop his 'Every Individual Matters' model as a catalyst to engender and embed shared vision and common purpose in organisations, making the workplace more humane and more effective. He recently published “The Democracy Delusion” to challenge wider socio-economic and political management issues, and proffer new solutions, building on these concepts.",accountant,Male
"L. John Walpole has been issued a Tennessee license number 3100. All CPAs, including L. John Walpole, have at the minimum an undergraduate degree in accounting, passed a rigorous national exam and adhere to mandated continuing education requirements of their states in which they are licensed. CPAs can work in private industry, education or government but most people think of CPAs during tax season as the experts in tax preparation. Their overall training in business and knowledge in principles of general law and taxation provide CPAs with the skills to help individuals with both personal and business financial decisions.",accountant,Female
"Most recently, he was Deputy Group CFO at interdealer broker ICAP. Stephen has also held posts as CFO at EBS, the spot FX electronic trading platform, and Deputy Head of Finance at the London Stock Exchange.",accountant,Male
"He was employed with the very well-known company Price Waterhouse. Since 2003 he has also been recognized as a patient advocate leader with the Bone and Joint Decade (a global alliance of musculoskeletal health). In his early 20’s Peter was affected by severe joint problems in his left hip. He tried countless therapies, but found very little help.",accountant,Male
"He has over 25 years of experience in tax preparation for individuals, small business and estates, and is a graduate of the University of Michigan-Dearborn Martin Lavelle, Secretary",accountant,Male
"David Madore, a private citizen, has asked her to take a look at Columbia River Crossing’s books. KPAM host Victoria Taft asks her what she’s uncovered. Couch reports having difficulty obtaining what she calls some of the basic accounting records ...",accountant,Female
"She loves being an accountant. The variety and problem solving aspects of the job keep each day fresh. She spends any spare time with her husband, children and grandchildren.",accountant,Female
"They have two grown sons and three beautiful granddaughters. In her free time, Laurie likes to spend time with her family, travel, write, work in her hosta garden and solve diagram-less crossword puzzles.",accountant,Female
"He has over five years of experience in public accounting, with an emphasis in higher education accounting regulations. Brent holds a Bachelor of Business Administration in Accounting from the University of Texas at San Antonio. In his free time, he enjoys reading, exploring Southern California, and being an audience member at television tapings.",accountant,Male
"His firm provides tax preparation and planning, contracted CFO services, representation before state authorities and the IRS, bookkeeping, retirement and estate tax planning, back office management services and computer systems consultations.",accountant,Male
Kevin is the principal of his own Accounting firm and supports corporate services as well as community services. Kevin brings great support to Real Advantage Institute and to the general community.,accountant,Male
"He has worked previously with Fifth Third Bank and Bank of America leading best-in-class sales, service, production and operations teams. Rick has a BA in Public Relations and Journalism from Lipscomb University and a Master of Business Administration degree from Middle Tennessee State University. In addition to his tax and advisory practice, Rick works with businesses who wish to streamline their financial reporting using cloud-based reporting systems to provide timely, accurate information. He also represents clients who are under review with the Internal Revenue Service and state tax authorities.",accountant,Male
"His 40 plus year career includes being an audit partner in Arthur Andersen, a member of Andersen’s Professional Standards Group (“national office”) in Chicago, the Director of Financial Reporting for a Fortune 50 company and most recently, the editorial director of CCH’s Accounting Research Manager. Currently, Ron does independent writing and analysis together with accounting consultation on a variety of topics.",accountant,Male
Mr. Bello is the president of the OFW Congress in Riyadh. He initiated the raising of a big amount of money from the OFWs for the Guinsaugon Landslide victims in Southern Leyte through the Secretary of Labor Marianito Roque to OWWA.,accountant,Male
"Mr. Chopra during his career span of over 30 years has held senior management roles in several industries - trading, projects, manufacturing and other diversified businesses.",accountant,Male
"After he received his Master of Science in Accountancy, he began his career working for a big four international accounting firm in their tax division. Later Mr. McLean opened his own professional private practice where he has worked for private companies, and has 30 years’ experience in public accounting specializing in international tax planning and accounting. James is also a member of the American Institute of Certified Public Accountants (AICPA), the Texas Society of CPA’s (TSCPA), the TSCAP Committee for Relations with IRS, AICPA Tax Section. He is certified as a Charter Global Management Accountant and Accredited in Business Valuation by the AICPA.",accountant,Male
"He has also appeared and cleared Certified Public Accountant course from USA. Over the years while working with various organisations both in India and abroad, he has gained rich experience in dealing with various facets of Finance and Accounts. Out of 20 years of experience he has spent 10 years in the aviation industry while working with Club One Air since 2005.",accountant,Male
Regis joined starafricacorporation in 2006 as Group Finance Manager and was subsequently promoted to the post of Group Finance Director. He was appointed to the Board of Directors in January 2011.,accountant,Male
"He has worked as a financial services professional to both public, and private sector projects in Sierra Leone, and Ghana. He is a Managing Partner at BDO (previously PKF Sierra Leone) an international financial services and business consulting firm with member offices across the globe. He leads engagement and reporting for BDO audit clients including; CARE, USAID, and multiple EU and World Bank funded projects.",accountant,Male
"He offers exhaustive knowledge of reporting practices and requirements for public companies based in Canada and the United States. Wilmot has been involved in numerous business valuations and acquisitions, high tech start-ups and international mining operations.",accountant,Male
"Besides her dream of a world of limitless energy, she has always been passionate about the non-profit sector. Julie started her career and worked in the non-profit sector for years before leaving to help the solar industry. She enjoys spending her free time in aid of the non-profit organizations that are close to her heart.",accountant,Female
"She now volunteers as a teaching assistant in first grade at Longfellow Elementary School. She currently serves as treasurer of MWA's Island Range Chapter. She enjoys hiking, wildflower photography, and snowshoeing.",accountant,Female
"In addition to a comprehensive range of services, some of the specialities offered by Jesowshek and his firm include tax planning and preparation, with a deep understanding of best practices as it relates to cryptocurrency.",accountant,Male
"That is, her real life. As the monotonous nature of crunching numbers and drawn-out board meetings slowly eats away at her, the only bright side to her otherwise mundane routine lies on the black and white pages of her debut romance novel. Her inspiration? A long-time infatuation—Tyler Andrews. Until the Olympic swimmer read her novel and connected the dots… Tyler Andrews is used to being the center of attention. […]",accountant,Female
"Carla has operated her own accounting practice, been employed as a tax accountant for both small and large accounting firms, and held a position with a “Big 4” accounting firm. Previously, Carla served as the Chief Financial Officer for a mid-sized manufacturer in Virginia, and held academic appointments such as Chair of the Department of Accounting and Finance. Carla specializes in teaching taxation, managerial accounting, and controllership, and has also taught courses in financial accounting, energy accounting, corporate finance, and entrepreneurship.",accountant,Female
"He has 9 years of direct non-profit experience in the design and construction industry. Mr. Fargo’s expertise includes management of staff, strategic planning, budget preparation, financial statement presentation, and audit and tax preparation work.",accountant,Male
"For twenty years he was the CFO and then CEO of a Virginia hospital and nursing home in a large healthcare company. He wrote short stories as a young man, and at the College of William and Mary, he really learned to write. He is a life-long lover of Corvettes, Las Vegas, and living on the edge. He is in love with his family, and he is passionate about United States and Mexican history, the Spanish language, and using social media.",accountant,Male
"She holds a Bachelor of Business Administration from York University and is currently working toward her Chartered Accountant designation. She has volunteered with various charities including The Toronto Enterprise Fund, Grameen Bank, BRAC and the United Nation. Shatabdi’s involvement with the United Way began in 2008 when she joined Scotiabank. Currently she is a Cabinet member for the Scotiabank GenNext team. This is her first year on the GenNext Cabinet and she is excited to work with the team.",accountant,Female
"He graduated from Polytechnic Ibadan and he is a member of ICAN where holds a certificate in Associate Accounting Technician, he is also member of Institute of Directors. Due to his large contact in Estate management, he is currently an active member of Global Estate Institute.",accountant,Male
"Mr. Thomas provides support for the accounting team by tracking and processing payments for consultants and program advisors, as well as general support for the accounting department. Prior to joining the Foundation, Mr. Thomas was a senior accounting associate with Prudential under the centralized business services team. He has a BS in accounting from Rutgers University Business School – Newark Campus.",accountant,Male
"He received his AA in Accounting in 1994 graduating with honors from New Hampshire Technical College in Laconia. He began writing history and engaging in Archaeology as an amateur in 1995. In 2002, he returned to school to study Archaeology and Anthropology. He graduated summa cum laude with a BA in Anthropology from the University of New Hampshire in 2007. He currently works as a field Archaeologist for Crane & Morrison Archaeology, Freeport, Maine, while pursuing graduate studies in the Historical Archaeology Program at the University of Massachusetts Boston.",accountant,Male
"Deidra D. Jones has been issued a Mississippi license. All CPAs, including Deidra D. Jones, have at the minimum an undergraduate degree in accounting, passed a rigorous national exam and adhere to mandated continuing education requirements of their states in which they are licensed. CPAs can work in private industry, education or government but most people think of CPAs during tax season as the experts in tax preparation. Their overall training in business and knowledge in principles of general law and taxation provide CPAs with the skills to help individuals with both personal and business financial decisions.",accountant,Female
"During the events leading up to his wedding, Lionel crosses paths with E.L. ""Tenspeed"" Turner, a smooth-talking fast-thinking con artist. When Tenspeed needs a job to make parole, Lionel fulfills his life's ambition, start a detective agency, and hires Tenspeed as his partner. Now the two men take on whatever cases come their way.",accountant,Male
"Banning received her Bachelor of Science degree in Accounting from Washburn University, Topeka, Kansas. She specializes in medical practice consulting and tax planning and financial consulting and is licensed to practice public accountancy in Kansas. She currently serves on the Board of Directors of the Dodge City Area Chamber of Commerce. She and her husband Justin, have one daughter, Rachelle. She enjoys traveling, family and friends.",accountant,Female
"He has significant exposure to Audit, Venture Capital Funding, Finance and Accounting, M&A, Financial Due Diligence and Private Equity Fund operations.",accountant,Male
He has around nine years of experience in the field of investment research (equity and fixed income) with leading financial services firm such UBS and Guggenheim Transparent Value. ...more,accountant,Male
"Ms. Murphy has worked as a controller in the software and professional services industries. Her background includes merger and acquisition analysis, due diligence, and execution in both domestic and international markets. Ms. Murphy is experienced in preparing statutory SEC filings for ongoing operations and initial public offerings.",accountant,Female
"He began his career as a Revenue Officer for the IRS in Fort Smith, AR. As an IRS Revenue Officer, he was responsible for enforcing tax laws and bringing taxpayers into filing and paying compliance. This experience gave him a unique skill set that is not possessed by most CPAs and makes him uniquely qualified to handle IRS resolution cases.",accountant,Male
"Since he started in 2009, Kunal has quickly has risen to the top 10 comedians of India, performing in 18 cities in India. His international career includes Nepal, Sri Lanka, Dubai, Holland, Paris, Barcelona and his aunt’s living room in South Mumbai. Kunal is the co-founder of East India Comedy, a popular comedy collective and YouTube channel.",accountant,Male
"He has significant experience with medical, manufacturing and service businesses designing, installing, operating, and managing accounting and tax operations. Chuck received his MBA from Northwestern University in 1974. He enhanced that strong background with work experience and continuing education from many professional sources including Price Waterhouse and Harvard University.",accountant,Male
"He joined the CollegeAmerica workforce in Could of 2013. His accounting experience consists of six years of working as an auditor for a nationwide accounting agency, three years of governmental accounting, and two years business management. He primarily makes a speciality of financial statement audits and preparation helping to realize financial targets by means of external reporting. His experience on each side of the accounting desk has allowed Kyle to share real-life examples of arduous-to-perceive subjects in the classroom.… Read More...",accountant,Male
"Zeleke, CPA firm. She joined the firm since November, 2016 and she is responsible for assising in preparing tax returns for individuals, businesses, corporations and tax-exempt organizations with the firm's CPA. She also works closely with the firm’s CPA on various bookkeeping, accounting and auditing projects. She graduated from Lake Forest College with a Bachelor's degree in Finance. She was in Dean's list and received awards including Omicron Delta Epsilon Economics Honor Society and an Academic Excellence Certificate from Lake Forest College. Hella is currently taking her extended courses to be a CPA candidate.",accountant,Female
"She began working for a mid-sized firm in Wichita, Kansas soon after graduation. After spending six years at that firm, she decided to open her own business in 1994. Since then, she and her team have focused on providing reliable accounting and bookkeeping services in the Derby and Wichita, KS areas.",accountant,Female
"While Alison has worked with several different industries, her expertise is within construction accounting, financial statement consolidations, QuickBooks setups and cleanups, and working with closely-held businesses.",accountant,Female
"He retired from professional practice to become the Secretary to the Keswick Convention from which he retired in 2004. He lives in Heathfield, Sussex and is married to Barbara. Mark was chairman of the Board from 2001 to 2010.",accountant,Male
"He conducts his life as he does the spreadsheets he works on; with careful review of all the variables. His philosophy serves him well in his other profession: an assassin. When he goes to his next ‘assignment’ he finds his target has already been murdered by a serial killer known as ‘The 3-Monkey Killer’. Book must now find the killer before the killer finds him, and before he is arrested for the psychopath’s crimes. And before his own crimes are revealed.",accountant,Male
"Until July 2015, he was CEO of Manx Telecom plc and led its successful AIM IPO in February 2014. Before becoming CEO in April 2011, he was Director of Finance and had been part of the British Telecom plc team which set up Manx Telecom plc in 1987. Prior to his 29 years at Manx Telecom plc, he spent four years at British Telecom plc. Before that, Mike held accounting and company secretary positions with the Dowty Group, Iloman Engineering and Castle Industries. Mike holds a BA (Hons) degree in Business Studies and CIMA qualification.",accountant,Male
"He is chair of Ballymun Regeneration Limited (BRL), is on the board of Special Olympics Ireland and is chair of consultants The Amethyst Group. He and his wife, Edel, live in Killiney, Co Dublin, and have four adult children",accountant,Male
"Likaj specialized in employment and payroll solutions, accounting, and domestic tax. She advises on accounting and tax matters and prepares financial reports according to client compliance requirements. Likaj has extensive experience in the banking industry. She graduated from the State University of Tirana, Faculty of Economy, holds a BSc in Finance, and is fluent in Albanian, English, and Italian.",accountant,Female
"Prior to joining Vintage in 2013 he worked as a financial advisor at Plante Moran Financial Advisors. He has extensive experience with accounting, tax preparation and wealth management.",accountant,Male
"In addition to teaching ethics to Enrolled Agents, he also teaches QuickBooks and prepares candidates for the Special Enrollment Exam. He has over 12 years experience in the accounting field.",accountant,Male
"She has served as a finance and accounting expert in the Washington DC metro area for over ten years, primarily focused on not-for-profit accounting. Ms. Norman attended both the University of California Los Angeles (UCLA) and Trinity College, earning a Bachelor of Science degree in Business Administration from Trinity College (now Trinity University) prior to becoming a CPA.",accountant,Female
Individually he runs his own consulting firm and serves as a tax professional here at EPG. He has served as an accountant and senior accountant for companies including non-profit organizations.,accountant,Male
"Before joining Jefferson Wells, McNelis routinely worked 60 to 70 hours a week plus weekends, with especially late nights to get out financial statements. Now she averages about 45 to 55 work hours a week.",accountant,Female
"His experience includes financial management, banking and insurance relations, sales, operations, and general management. Terry has experience with several business acquisitions and sales. Most recently Terry was CEO of a large real estate development company. Terry also is uniquely qualified to provide guidance as a current franchise owner of six Budget Blinds franchises.",accountant,Male
"Along with his wife Paula, Mark is one of the Founding Board members of The Sue Weaver C.A.U.S.E. Mark took a short leave from the board and is back with a real passion for C.A.U.S.E. Certification.",accountant,Male
"After working for about four years with M/s Larsen & Toubro Limited and SSA Global Technologies (BaaN) Pvt Limited, he joined Infosys Limited in August 2005 as an SAP FI/CO consultant. He was selected as a speaker for the America’s SAP Users Group (ASUG) meeting in Dallas, Texas, on October 2008, where he presented a paper titled “SAP System Appreciation Study-FI/CO.” He is currently working as a lead consultant-SAP FI/CO with Infosys’ Consulting and System Integration unit and is based out of Singapore. He has been involved in SAP (core and IS retail) implementation, upgrade, and production support projects for clients across the USA, EMEA, and APAC.",accountant,Male
"He has served in management and on the boards of a number of Canadian companies. He is currently CFO Riverside Resources (TSXV: RRI) and Northair Silver Corp. (TSXV: INM), and a director of Entourage Metals Ltd. (TSXV: EMT). Mr. Scott is a co-founder and a director of Pan American Hydro Corporation, a private company involved in developing small hydro projects in Latin America. Mr. Scott earned his CA designation in 1998, his CFA designation in 2002 and has a B.Sc. from the University of British Columbia.",accountant,Male
"Spitz & Associates in Madison, Wisconsin. (Hereafter, all references to petitioner are to William Spitz.) During the years at issue, petitioner was a partner in the certified public accounting firm of Baillies, Denson, Erickson and Smith (Baillies, Denson) of Madison, Wisconsin, engaging in financial consulting and tax return preparation, among other things. Previously, he was employed by the Internal Revenue Service in Chicago, Illinois, as a revenue agent from 1961 to 1964.",accountant,Male
"He has held several senior positions with both multi-billion international companies such as Tyco International and Compass Group PLC as well as entrepreneurial businesses such as Bravo Brands. He has extensive food/beverage and health food supplement experience. Mark, a native Floridian, enjoys his time as a father and is passionate about exercising, particularly weight lifting. He obtained both his undergraduate and graduate degrees from the University of Florida. He has maintained intensive physical shape through the years, runs a very respectable mile and can bench well over 300 lbs.",accountant,Male
"He is senior VP and Director of a successful global marketing company Vinmar International, Houston. Swatantra Jain is actively involved with various Indo American community organizations in Houston. He is a President of Pratham Houston and Treasurer of Pratham USA, founding member and Chairman of JVB Houston and a Board Member of International school of Jain Studies.",accountant,Male
"Markets Brian likes to investigate Financial, Sports, Social, Political Capital and Internet trends. Since some of his findings involve financial areas he posts content on Seeking Alpha. Brian is a... MoreMy blog:The Humble Accountant",accountant,Male
"She currently leads the Commonwealth of Puerto Rico’s Economic Development Office in New York where her main role is to raise awareness across the United States about the tax incentives and business opportunities in Puerto Rico and facilitate investment opportunities in the island. She has 15 years of experience both in the private and public sectors. Her private sector experience includes roles in taxes, finance, banking and business management in the technology and financial services industries. She has worked for Banco Santander, Deloitte & Touche, Accenture and Louis Capital Markets in Puerto Rico, New York City and London.",accountant,Female
"With an interest in small business and strong administrative and organisational skills, she enjoys providing ideas and solutions to help clients grow their business.",accountant,Female
"She received a Bachelorï¿½s of Business Administration with a 4.0 GPA from the University of New Mexico. Ale then began her professional career in 1992 as an auditor at Arthur Andersen, LLP, in Albuquerque, New Mexico. She later joined KPMG, LLP, in Houston and became a senior manager. From 2004 to 2006, Ale served as CFO for entrepreneurial companies. She also held a controller position with a $2 billion publicly held oil and gasï¿½services company.",accountant,Female
He’s a college educated CPA. His degree got him a job with the State of Connecticut. He investigated tax fraud. After twenty years he took the money and set up a cottage industry out of his … Continue reading →,accountant,Male
He enjoys creating innovative and specialized solutions for each of his clients and enjoys helping individuals and small businesses with tax consulting and strategic planning matters.,accountant,Male
"She is currently the Board Treasurer for Pet Partners, a nation-wide therapy animal nonprofit organization. She is also a Certified Field Traumatologist and Compassion Fatigue Educator with Green Cross Academy of Traumatology.",accountant,Female
