hard_text,profession,gender
"Mr. Cox has been a key member of the executive team for several successful start-up and turn around businesses. His experiences include helping restructure the accounting and finance department of QVL Pharmacy ; raising additional funding to rebuild the Sales, Marketing and IT departments; performed as Chief Financial Officer for Alden Resources LLC shortly after it started in 2007 as a start-up $35M coal mining company.",accountant,Male
"Her aim is to provide professional bookkeeping services to local businesses at affordable rates. Clare also specialises in computerised bookkeeping software, and can assist in the choice of software, installation, training and on-going support.",accountant,Female
"Previously Chief Financial Officer of Benfield Group, John was a instrumental in the development of the business into the world’s leading independent reinsurance and insurance intermediary, as well as overseeing its listing on the London Stock Exchange in 2003 and its successful sale to Aon Corporation in 2008. Prior to joining Benfield in 1994, he was London Senior Partner of Lloyd’s specialist auditor Neville Russell (now Mazars). He joined the Board of Cooper Gay (Holdings) Ltd as Non-Executive Director in July 2009.",accountant,Male
"Shaz’s skill and prowess as one of the UK’s most successful business growth strategists means that his services are constantly in demand and highly prized. Within excess of 2,750 business growth consultations to his name and real cash gains equaling tens of millions for his clients, he knows how to successfully grow a business.",accountant,Male
He is an Insolvency Professional registered with the Insolvency and Bankruptcy Board of India. He is also taken a Master in Business Finance and a valuation certification from the Institute of Chartered Accountants of India.,accountant,Male
"He has over 12 years teaching experience on professional accounting related subjects. He is an adjunct lecturer of HKU SPACE and routinely conducts various lectures in the institute, including bachelor degree program. He has lectured the subject Advanced Audit and Assurance in revision program course of CPA Australia launched through HKU SPACE. He is also a technical consultant of a long established local CPA firm.",accountant,Male
As the former managing director of Alliance Trust Equity Partners he was responsible for strategic development. Previously he founded the UK venture investor Albany Ventures and prior to that was Director of Investment at British Linen Bank. Raymond also serves as Chairman of Foresight plc and Integrated Environmental Solutions Ltd. Raymond joined the Board in June 2013 and was elected Chairman in July 2017.,accountant,Male
"Acting on a whim, Sid finds himself drawn into a world of intrigue that takes him to Paris, the Sahara desert, Switzerland and finally into the Islamic mosques of Cleveland.",accountant,Male
"He’s currently the CMO of Cincinnati-based startup Sqrl. Craig’s also a BBQ enthusiast, writer, and purveyor of delicious vintage cocktails. Follow him on Twitter @craignbaldwin",accountant,Male
"He has worked at senior and director level with several large PLCs and, in addition to his financial, general management and personnel skills, he has a well rounded appreciation of the techniques used by successful organisations to maximise efficiency, control resources, train and develop staff and identify the need for and management of change.",accountant,Male
"She brings a wealth of experience in customer relationship management having previously worked as a manager in the hospitality industry. At Ushindi Bora, she is in charge of client recruitment drives and on-boarding. Ultimately, she ensures customers’ satisfaction is prioritized throughout the company’s branch network.",accountant,Female
"He began his career at PricewaterhouseCoopers, where he worked in the area of audit and business assurance as a manager in the Atlanta office. Upon returning to Albuquerque, he worked as a manager in a local accounting firm, specializing in taxation and business valuation.",accountant,Male
"She was born in Pali – Marwar, Rajasthan, India. Creating mehandi designs was her hobby from childhood. She used to apply mehandi on herself and others with great interest and passion. In the year 2012-13 an urge of creativity emerged and was converted into mehandi designs to publish a book, so that it can be shared with the world. Thus a hobby became a book. Contact details : Vinita Kalyani C/o Shri Sagarmal Kalyani Bandar, Kalibadi Road (Naharmal Kalyani Road) Raiganj, Uttar Dinajpur, West Bengal -733134, India. E-mail Id: vinitajajoo@rediffmail.com",accountant,Female
"Sammy writes that when he went to UNC Asheville for accounting courses, he also took a commercial law class taught by Tom Lawton '79 who serves as the campus's general counsel. Melissa Himelein '81 is also a professor of psychology there.",accountant,Male
"Gretchen has audited a variety of different local and state municipal clients including Cities, Townships, Counties, Libraries, Drain Commissions, the Michigan Lottery, MSHDA, and the Michigan Higher Education Authority. She is also a Board Member for the MGFOA and sits on both the Standards and Professional Development Committees",accountant,Female
"His areas of concentration include estate planning, corporate law, probate administration, as well as residential and commercial real estate and divorce law. Upon graduation from college, John joined the national accounting firm of Coopers & Lybrand. That experience enabled him to obtain his C.P.A. credentials. Later, while attending law school at night, he was employed by the Bank of New England-West as an Assistant Vice President where he managed the Bank’s Internal Audit Department.",accountant,Male
"Tom received his Bachelor of Science and MBA degrees with an emphasis in finance from the University of California, Berkeley. He serves his local community as a member of the board of directors of the Placer Community Foundation.",accountant,Male
"This experience gives him the ability to analyze client’s needs from both a legal and financial perspective. Wayne also has an LLM in Taxation from the University of Florida Law School. His areas of practice include corporate tax planning, estate and business planning, business succession planning, general corporate, limited liability companies and partnership law.",accountant,Male
"She plans on pursuing her Certified Public Accountant license in the near future. Michelle enjoys relaxing, meeting new people, dining out and giving back to her community.",accountant,Female
He provides straightforward and painless tax services. Eckstein is trying to break the decades-old stereotypes and make a trip to the accountant a pleasant experience.,accountant,Male
Below Ms. Brand offers tax tips for individuals and businesses impacted by the recent hurricanes The President has declared that a major disaster exists in all 67 counties in the State of Florida. Following the recent disaster declaration for individual assistance issued by the Federal […],accountant,Female
"He is a retired Associate Professor of Business from the University of Mary Hardin-Baylor. Bruce and his wife, Tina, moved to Salado in 1987. They have two married sons-Bradley and wife Sarah-Bryce and wife Jamie-and two grandkids - Carmen (age 5) and Brock (4 months). Bruce is also a Director and Treasurer of the Salado Water Supply Corporation.",accountant,Male
"He serves as a director on several mining companies, including Canuc Resources Corporation, Excellon Resources Inc., Corona Gold Corporation, Lexam Explorations and Valdez Gold. He has previously served as a director of, amongst others, Metco Resources., which was purchased by Breakwater Resources Ltd. in 2008 and Hudbay Minerals Inc. from June 2003 to 2006.",accountant,Male
"He is leading the overall functions of his accountancy firm, Seid Ali Authorized Accounting Firm, Febe Associate (Ethiopia). He has extensive experience of over twenty three years in the field of accounting and Finance in wide range types of sectors such as banking, insurance, construction, consulting, import-export trading businesses, service giving companies, NGOs, Mining companies, floriculture and integrated management information system implementation. He is in charge of different activities including day to day record keeping, preparation of annual returns, administer payroll, tax advisory, compliance, and perform closure of companies.",accountant,Male
"He has more than 8 years of working experience in various fields such as Accounting, Auditing, Financial Analysis and Capital Market. Prior to joining NIBL Capital, he worked as Chief Operating Officer (COO) and Company Secretary of Siddhartha Capital Limited for 3 years. As a COO and Company Secretary, he was instrumental in the successful launch of its maiden mutual fund scheme and follow on scheme. He has led the Financial Information analysis and Management and International Affairs for SEBON for four years which involved policy amendments and implementations. He has also been involved in teaching Financial Management, Derivatives and Accounting in various colleges along with participating in Capital Market programs organized in the USA, Japan, Malaysia, Philippines, Thailand, Sri Lanka, India and Nepal.",accountant,Male
"She has over 10 years of bookkeeping and is well versed in sales tax, accounts payable, and reconciliation. Erika works with several different types of clients, including but not limited to restaurants, law firms, medical and real estate companies. She is currently working towards obtaining her Certified Bookkeeper license. Erika’s precision and attention to detail ensures her clients financials are accurate and up to date with outstanding professionalism. Christi Via",accountant,Female
She works with small and medium-sized businesses and individuals. Lorraine services clients in all aspects of the accounting profession including tax preparation and tax planning as well as preparation of compiled and reviewed financial statements. She also provides guidance to rectify IRS examinations and collection issues.,accountant,Female
"One of Mary’s responsibilities is developing the ending inventory amount for the calculation of cost of goods sold each month. At the end of September, Mary noticed that the ending inventory for a new brand of televisions was much larger than she had expected. In fact, there had been hardly any change since the end of the previous month when the shipments of televisions arrived. Mary knew that the firm’s advertising had featured the new brand’s products, so she had expected that a substantial portion of the televisions would have been sold.",accountant,Female
"He is the L.P. and Bobbi Leung Chair of Accounting Ethics at Azusa Pacific University, a Christian university with over 10,000 students near Los Angeles, CA where he directs the School of Accounting. He is a nationally recognized author and speaker on accounting ethics and has served as Chair of the American Accounting Association's Public Interest Section. His scholarship has been published in several top academic journals, winning multiple best paper awards from the AAA. He is married to Alyssa with three sons, Joshua, Benjamin, and Jacob.",accountant,Male
"Mr. Scharf served as Chief Financial Officer of Exall from May to December 2006, Executive Vice-president, Corporate Development of HudBay Minerals Inc., a public company listed on TSX from 2003 to 2005, Chief Financial Officer and a director of Southern Cross Resources Inc., a public company listed on TSX from 1997 to 2000, a director and Chief Financial Officer of Inmet Mining Corporation, a public company listed on TSX from 1988 to 1996, Vice President, Finance of Placer Dome Inc. from 1987 to 1988 and Chief Financial Officer of the Dome Mines Group from 1978 to 1987. Mr. Scharf has been a director of Gold Eagle since December 2006 and a director of Asia Now Resources Corp., a public company listed on TSX Venture since February 2006. Mr. Scharf holds a Bachelor of Arts degree (Economics) from York University in Toronto.",accountant,Male
"She graduated from the University of Indianapolis in May of 2014 with a double major in accounting and finance. At the University of Indianapolis, Dorothy was the Accounting Manager for Team Business and was a part of the Student Business Leadership Academy. She is from Zionsville, Indiana and enjoys reading and spending as much time as possible with friends and family. djtokar@lw-cpa.com",accountant,Female
"He previously served as Finance Manager and Controller for Starr Restaurants and Starr Catering Group in Philadelphia and as Unit Controller for New York’s Union Square Hospitality Group, LLC. A native of Washington state, he served as senior tax accountant for Seattle’s Moss Adams LLP regional CPA firm, and as staff accountant at Clothier & Head.",accountant,Male
"He has also received his accredited in business valuation (ABV) credential from the American Institute of Certified Public Accountants (AICPA), accredited senior appraiser (ASA) designation in business valuation from the American Society of Appraisers, and chartered financial analyst (CFA) credential from the CFA Institute. He also has a degree in accounting from the University of Iowa.",accountant,Male
"She started working with Adam Rosenberg & Company, CPAs in October 2005. She is responsible for preparation of financial statements, payroll, and tax returns.",accountant,Female
Ms. Kiley has served in various positions at the County during a high growth period where the budget grew from $64 million to $300 million. Ms. Kiley has served on a number of boards and committees including board member for the Texas Association of County Auditors (TAC) from 2008-2010 and was the recipient of the Denise Linch Assistant County Auditor Award from TAC in 2010. She holds a BBA in Accounting from Texas A&M University.�,accountant,Female
"She is Chairman of UraniumSA Limited (ASX listed) and a Director of Adelaide Community Healthcare Alliance Inc (ACHA). She is a member of the South Australian Government’s Minerals and Energy Advisory Council, a councillor of the South Australian Chamber of Mines and Energy (SACOME). She is a former Director of Benefund Ltd and former Director of Forestry Corporation of South Australia, a former member of the Corporations and Markets Advisory Committee (CAMAC).",accountant,Female
He is a numbers man. He has absolutely no business being in charge of evaluating players. It’s why the majority of recent draft picks have turned out to be disappointments. It’s why good players like Danny Woodhead were waived and are now playing at a high level on other teams when they could be playing for the Jets.,accountant,Male
"Mr. Zdimal’s primary emphasis is in the area of conducting global investigations into matters involving alleged corruption & bribery and financial reporting-related fraud. Mr. Zdimal provides proactive and reactive investigative advisory services to attorneys, audit committees, corporate management and internal audit functions around the world – including trainings, risk assessments, program assessments and on-call investigative response services.",accountant,Male
"Peter’s wide variety of industry experience includes manufacturing, construction, healthcare, and agri-business, among others. He has over 15 years of experience preparing and reviewing small-business and individual tax returns, as well as representing clients in front of the IRS and state revenue agents.",accountant,Male
"He is a Business Mentor for Virgin StartUp and has a proven track record for driving phenomenal growth with big names such as Virgin, Carphone Warehouse, Regus PLC and Future PLC.",accountant,Male
"Born in Tahoka, Texas, he grew up in Lubbock. Sandra Henderson Brown, a retired employee of the Hale County Appraisal District, was born in Slaton, Texas, and grew up in Lubbock.",accountant,Male
"As the Senior Manager of Coaching and Performance for Apercen Partners, she is responsible for leading strategy around people and culture and ensuring the organization is an outstanding platform to build a career in the space of comprehensive tax compliance and consulting solutions for ultra-high net worth families.",accountant,Female
"A certified public accountant, she has 15 years of experience in public accounting. She started her audit work with Arthur Andersen in Manila, Philippines working with clients in the banking, finance, and manufacturing industries. She has also worked in Indonesia as part of the internal audit department in one of the biggest conglomerates in the country. Prior to joining RI, Ms. Averia worked as an external auditor and accounting consultant working primarily with non- profit organizations. Ms. Averia holds a Bachelor of Science in Commerce Degree Major in Accounting from Assumption College in Makati, Philippines and she passed the Philippine CPA Licensure Exams in October of 1989.",accountant,Female
"To See how he takes Christ along with him to work visit http://www.hiscpa.com/ (An Atlanta CPA firm) To contact John Dillard CPA (Atlanta Christian Author/Speaker) today call 770. 814.9304 proudly serving Duluth, GA, Gwinnett County and Beyond.",accountant,Male
"He has completed his MBA from Indian School of Business.He has more than 10 years of experience of working in banks like HDFC Bank, Standard Chartered Bank and ICICI Bank. He has excelled in finance and has worked in departments like Credit Risk, Corporate Banking, Relationship of SME Banking, etc.",accountant,Male
"She has been an accountant for nearly 30 years. Denise, her husband Jared and their three children, all graduated from the ISD. She is also treasurer on the board of the Child Abuse Prevention Association (CAPA).",accountant,Female
"Sultan Ahmed is a member of CPA Australia and IPA Australia and Registered tax Agent besides that he completed his M.com from University of Wollongong and Masters in Taxations from University of Western Sydney and has more than nine years experience in the field of Taxation, Accounting, Financial reporting and compliances a young and vibrant result driven professional.",accountant,Male
She graduated from Daystar University with a Bachelor’s Degree in Commerce Majoring in Accounting. Sarah has over three years’ experience in accounting.,accountant,Female
"Daniel has been working in East Africa for the last 5 years working for a variety of non-profit organisations. After many years in Australia working in public practice in both audit and taxation services, specializing in working with the charitable sector, Daniel moved to Tanzania to work for a large 1800 student K-12 school in Tanzania. Most recently, he spent 2 years working as a Finance Manager for an International NGO in South Sudan. Outside of work, Daniel enjoys playing golf, reading books and is an avid Essendon (AFL) fan.",accountant,Male
"He worked in Europe and London, for printers, publishers and the trade union NALGO. He suffered a heart attack at a table tennis match in 2004, since when every day has been an unexpected bonus. In 2011 he founded Chaville Press, which has published ten books, all by local authors and artists including Keith’s book Friern Barnet – the library that refused to close. Keith is a member of N12 Artists and Finchley Art Society, and has exhibited at artsdepot, The Hasler Gallery and The Bohemia.",accountant,Male
"She has been involved with auditing both SMEs and Large Corporations. She serves as a Business Consultant to various companies in the service sector, real estate sector and manufacturing sector.",accountant,Female
"Jensen began his career and training with KPMG LLP. He was in the public practice sector for six years, concentrating in commodities-based accounting and tax prior to entering the resource sector where he has been responsible for reporting on exploration and operations.",accountant,Male
He has been with the company since December 2016. Danny graduated from SUNY at Buffalo with a bachelors in Business Management with concentrations in Finance and International Business.,accountant,Male
"She has been in public accounting since 1998, after earning her Bachelors’ degree in Accounting from Florida Atlantic University. She joined Reed and Company and received a Masters in Accounting with a major in Accounting Information Systems in 2000. Fanny is a member of the FICPA. She has also had the great opportunity to be part of the staff of her Alma matter, Florida Atlantic University, as an adjunct professor in the business department. She enjoys working with businesses owners and individuals in the areas of software implementation, QuickBooks consulting, strategic planning, tax reduction planning, financial planning, and business profitability analysis. She enjoys using technology to benefit her clients.",accountant,Female
She was born in Kiev and has lived there all her life. She graduated from Kiev Technological Institute of Light Industry with a desire to make elegant dresses for women but it didn’t work out. Instead she fell in love with numbers and it became her passion and her calling.,accountant,Female
"She prepares tax returns for individuals, partnerships and corporations. In addition, she frequently prepares accountings that are submitted to the court for trusts, estates and conservatorships.",accountant,Female
"He has over twenty years accounting and business experience in a wide range of organisations, from small local businesses to large national and international companies.",accountant,Male
"In 2000, she first joined PRIMEX as Assistant Manager for Finance and Administration, where she handled accounting, bookkeeping, and taxes. She also managed the USAID-funded Coastal Resource Management Project, which covered six provinces (Cebu, Bohol, Palawan, Davao, General Santos, and Negros Oriental) in the Philippines from 2000-2004. Read More",accountant,Female
He has worked for a number of companies across different industries over the past 13 years in Swaziland and South Africa. He has sat in several Boards and currently sits on the Board of major financial institutions. The SOS Children’s Villages Swaziland will benefit immensely from his vast knowledge in Finance and related matter. He enjoys reading and travelling.,accountant,Male
She has been acting and designing sets for JCCT for the past three years. Paige has also acted and worked backstage in many Theatre-at-Tusculum productions. She is the Business Coordinator of the newly formed Greeneville Theatre Guild and was a driving force in its creation.,accountant,Female
"Khattar & Associates, which was set in 1990. The Firm carries Audit of various companies engaged in Hotels, Real Estate, Healthcare, Malls and other manufacturing units.",accountant,Male
"In fact, he is a known entrepreneur in the region for almost two decades. His team consists of expert consultants, professional accountants, seasoned tax professionals and marketing experts, who have years of individual experience. Mr. Smith keeps a personal check on the requirements and needs of every client and likes to offer his suggestions and advice for financial decisions.",accountant,Male
"He designed and maintains a best-in-class financial reporting structure, providing executives with timely statements, forecasting models, and regulatory reports for state agencies and licensing bodies.",accountant,Male
"He is a partner with KPMG and has provided audit and advisory services to clients for more than 26 years with extensive experience in the automotive, technology, global manufacturing and mining industries.",accountant,Male
"He provides accounting, auditing, and taxation services and assists business owners in determining a value for their company for succession planning, gifting, estate values, sales and mergers, and other purposes. Prior to joining Shultz Huber & Associates, Inc. Tyson was a manager at a big six accounting firm.",accountant,Male
"She received a Master’s of Science degree in Accounting and Financial Management in 2008 from University of Maryland University College, and a Bachelor of Science degree in Accounting in 2006 from Frostburg State University.",accountant,Female
"Having worked for two successful accountancy firms, he decided to utilise his experience and form YM Accountancy Limited. His experience includes working with Nisa, Co-op, Budgens, Costa Coffee and was also involved in the catering strategy for the 2012 London Olympics.",accountant,Male
"He graduated from the University of Bristol with a BSc in Economics and Accounting in 2004 and joined Ernst and Young LLP where, after completing the graduate training programme, he qualified in 2007. Charles went on to join McQueen, an independent corporate finance house, based in London, before moving to the Tarncourt Group in 2008. He completed a leadership programme at Harvard Business School in 2009. Charles has been a non-executive director of Apache Capital Partners since 2010.",accountant,Male
"He is a member of both the American Institute of Certified Public Accountants (AICPA) and the Maryland Association of Certified Public Accountants (MACPA) and currently serves as treasurer of SEEC, a charitable organization. Keith can be reached at JenningsK@snydercohn.com. Visit the Snyder Cohn web site at www.snydercohn.com.",accountant,Male
"He is currently with the Ministry of Alberta Advanced Education and is the Director of Strategic Planning for Information Management and Technology. Previously he held roles, typically at the Director level, within governmental and consulting organizations. To contact Frank, visit www.myorgbio.org or email frank@myorgbio.org.",accountant,Male
