hard_text,profession,gender
"She specializes in inventory tracking, compliance, and sleuthing out solutions to stubborn problems. She most recently worked as a full-charge accountant at BioFuel Oasis Cooperative in Berkeley, California.",accountant,Female
"Her constant commitment to tax preparation runs deep – Alice holds a Masters Degree in Tax Administration. Additionally, she has experience with audits – IRS, State of Wisconsin Income, Unemployment and Sales Tax.",accountant,Female
"He started his career with ABS Plastics at Vadodara and then joined FAG Bearings India and stayed for a long period of 20 years. He subsequently joined Welspun Gujarat as President-Operations, to look after both the plant & Finance.",accountant,Male
"His experience includes individual, corporate, partnership and non profit tax returns. He also provides consulting services in the gaming and technology industries. In addition to CRR clients, Mark provides audit and accounting services to BDO clients.",accountant,Male
"Prior to working in Bermuda, he worked in Uganda with KPMG Limited as an accountant. He specialises in the audit of financial services and has also done audits in the aviation industry, manufacturing industry, government institutions and Not for profit entities. Dan is a chartered accountant in Uganda, Canada and also with the ACCA in the United Kingdom. He has also been a guest speaker at many functions for associations like ISACA. He also enjoys playing rugby, cricket and travelling around the world.",accountant,Male
"She believes in and tries to follow her dreams, she considers herself a newbie in the writing arena and a small fish in the blogging world open o be explored.",accountant,Female
"Laura graduated from Judson University with a Bachelor of Arts degree in Accounting in 2005. She also became a Certified Public Accountant in 2005. Laura and her husband, Michael, have a daughter, Elizabeth.",accountant,Female
"She brings her knowledge of finance, taxes and business to benefit the operation and management of Magenta Theater. Lori joined the board because of her love of live theater and performances of all kinds, having participated in various bands and orchestras in the region herself.",accountant,Female
"His public service career began in 1995 when he was appointed to serve on Kansas City, Kansas, City Council and was active in the consolidation of Kansas City, Kansas, and Wyandotte County. He was nominated Leader of the Year by KCK Housing/National Community Development and selected Ingram's Magazine 40 Under 40 Power Elite Class of 1998.",accountant,Male
"He has experience of advising a wide range of financial services organisations on risk, regulations and controls. Simon was a partner with KPMG responsible for the audits of investment, banking and insurance companies; he retired in 2012 and now works as an independent non-executive director, maintaining his knowledge as a Fellow of the Institute of Chartered Accountants.",accountant,Male
"Galante founded Paragon in 2003, and his experience prior to Paragon includes segment controller, financial and operational auditor, corporate accounting, budgeting, forecasting, financial analysis, process reengineering, and project management. Galante has held professional positions at Qwest, USWest/MediaOne, Dell Computers and Citicorp.",accountant,Male
"C. in 1992. She graduated college with a concentration in business. Her prior work experiences include processing tax returns at Dannible & McKee, CPAs, and performing bookkeeping and accounting tasks at Glider Oil Company and Logical Systems Corp.",accountant,Female
Brookfield quietly owns entire city skylines in places like Toronto and Sydney. It’s the biggest office landlord in London and downtown Los Angeles. Read more.,accountant,Male
He has been serving clients with accounting and tax preparation services for over 10 years. He continues to stay ahead by participating in Continuing Professional Education courses from local and nation accounting and tax associations. Roy is a firm believer allowing his clients benefit from the most modern technology by investing in the latest accounting and tax technologies.,accountant,Male
"Chicago Graduate School of Business. His concepts and comments have appeared in articles in the Wall Street Journal, Business Week, the Chicago Tribune and the Los Angeles Times.",accountant,Male
"She left her office to visit a client one day. On the way to the client another car sideswiped her vehicle, causing her serious bodily injuries. Her employer’s workers’ compensation carrier paid $100,000 in workers’ compensation benefits. Jane negotiated a third party settlement for the policy limit of $100,000 with the other driver’s carrier without hiring an attorney.",accountant,Female
"He specializes in all areas of federal and state taxation and handles the tax and financial aspects of trust and estate work as well as litigation support issues for local San Diego attorneys. He is a member of the California State Board of Accountancy and the California Society of Certified Public Accountants (CalCPA), and serves as a board member for CalCPA for which he is the committee chair for the annual San Diego Tax & Accounting Institute.",accountant,Male
"He holds a Bachelor’s degree in Mechanical Engineering from the University of Ibadan, Nigeria and an Executive Masters degree in Business Administration (Finance Option) from the University of Ghana.",accountant,Male
Jim has an extensive background in creating tax saving solutions for high net worth individuals and business owners. His experience working for several CPA firms in New Jersey and as a Controller for a privately held corporation has provided Jim the experience necessary to provide his clients with the services of a personal CFO.,accountant,Male
"He is the founder of Registrationwala, an online tech driven platform providing the legal consultancy services. He has proficiency in diversified areas including taxation, accounting, company incorporation, IT infrastructure management, IT strategy, various IT operations and IT management. Possessing a vast experience of over 6 years, Gaurav is a passionate entrepreneur and successfully converted himself from financial background to core IT technocrat. He has led the evaluation, selection, and implementation of newinformation system technologies and has been deeply involved in the execution of core IT projects. Currently, he is successfully running several other technology-based organizations.",accountant,Male
"While Paul’s practice is diverse, a significant portion of his engagement experience has been in the financial institution industry and investment-related investigations. Mr. Dopp has international engagement experience including matters in Canada, the Caribbean and Asia. He has testified as an expert witness on dozens of occasions in state and federal courts including testifying as an expert for the Department of Justice in federal criminal court in connection with a bank fraud.",accountant,Male
Kildare. Robert has worked closely with international charities spending time with Restless Development in Tanzania. He has a keen interest in CSR and entrepreneurial development initiatives in... Ireland’s Expert Safe Pass Course Providers,accountant,Male
"She is willing to assist all businesses with their accounting requirements, such as Financial Statements, Business Activity Statements, Company Tax Returns, Trust and self-managed Superannuation Fund Accounts",accountant,Female
"Her work focuses primarily on the accounts payable process for the New Venture Fund, a 501(c)(3) public charity, and the other nonprofits that Arabella manages. In addition to the accounts payable process, she supports her team on various accounting and financial projects.",accountant,Female
"After graduating from college, he spent six years as an accountant with the national accounting firms of Deloitte & Touche and Price Waterhouse. In private practice, Palma assisted Levi Strauss and Company and their team of accountants through a series of private debt offerings and a restructuring of their worldwide operations.",accountant,Male
"He is the past president of the Public Accountants Society of Colorado, and has been a Governor on the Board of the National Society of Accountants. His practice focuses heavily on tax and accounting issues associated with farming and ranching operations and agribusinesses.",accountant,Male
"He is a member of the American Institute of Certified Public Accountants, the California Society of Certified Public Accountants, and the Hong Kong Institute of Certified Public Accountants.",accountant,Male
"She holds a bachelor’s degree from the University of Wisconsin–Madison. She has supported a broad range of industries, and has worked in companies ranging from startup ventures to well-established businesses (publicly and privately held), including Western Union, Verio (an NTT Communications Company), and “Big 4” accounting firm Ernst & Young, LLP.",accountant,Female
"He lives in El Cajon with his wife, and looks forward to traveling more when he retires. James joined SD350 to do something for a future that is threatened by climate change. Working together with others is the way for him to have hope for that future.",accountant,Male
"Mr. Ryan has over 20 years experience in the preparation of financial statements, income tax returns, estate planning valuation, divorce, litigation and other areas of accounting/consulting. Mr. Ryan has taught litigation and valuation classes through the National Association of Certified Valuation Analysts (NACVA) for the Kentucky Bar Association CLE program.",accountant,Male
She then moved to Cable & Wireless where she spent two years in their internal audit department before moving into an investment appraisal role. Jo has taught AAT at Hillingdon College and until recently at Worcester College of Technology where she took on the role of AAT Course Co-ordinator.,accountant,Female
"He specializes in tax preparation, IRS tax resolution, lien releases, bank and wage levies, appeals, offers in compromise, acquisition, sales and mergers, financial planning and related services. Kingston is also available for expert witness testimony regarding tax and forensic accounting matters and business valuations.",accountant,Male
"He joined FINCORP in 1997 and has previously served as the Deputy Managing Director; Company Secretary; Manager Finance and Credit Analyst at FINCORP. In 2010 he was seconded to the subsidiary company, First Finance, as General Manager with the responsibility to set up First Finance Company which has to date become a well-known financial services provider of the first choice. He has been part of the core team that has transformed the FINCORP Group from its humble beginnings at the early stages to become a reputable development finance institution offering broad based financial services.",accountant,Male
He has held technical accounting roles at Barclays and PricewaterhouseCoopers and is currently the Director of Finance at Spongecell. Gary also advises NYC startups on infrastructure and scaling strategy.,accountant,Male
"After years working in multinational firms in many different countries, he decided to build his own firm around a more personal approach. And his new technology-led approach has had dramatic results for his clients.",accountant,Male
"She is a corporate professional turned writer who takes pleasure in writing about mythology, current social trends and food and regularly to contributes to various groups and writes blogs. She is passionate about storytelling, the ancient oral tradition and runs a storytelling group called Tales -To -Tell within facebook with wide readership and runs a storytelling club in central London which meets once a month to tell stories, analyse myths and most importantly to keep that magnificent oral art form – storytelling alive.",accountant,Female
"Within his role with the company, Arshad performs full cycle accounting duties including GST remittances, analyzing financial statements, accounts receivables, bank reconciliations, and month end procedures. Arshad is responsible for maintaining communication with tenants regarding bill payments and monthly rent.",accountant,Male
"He has earned a Masters in Taxation. As a licensed professional, he provides a full range of accounting and tax services, including accounting and tax services for Arizona medical marijuana dispensaries. He has more than twenty years experience in all aspects of taxation, accounting and audit, including income tax planning for closely-held businesses and high and middle net worth individuals. Lance has extensive experience with both federal and state tax audits and collection matters including offers in compromise. Lance’s clients include executives, attorneys, physicians, real estate professionals, small business and high net worth individuals.",accountant,Male
"A member of the New York State Society of Public Accountants, Ted is also a respected author. His books include The Serious Investors' Tax Survival Guide, The Trader's Survival Guide and $5 a Day to Financial Freedom.",accountant,Male
"In 1990, Ethiopia was a nation fighting against their government. Demonstrations and protests would occur in the city; some of these protests would turn violent. One of these violent protests broke out in the middle of the street. A shooting occurred and Desta was caught in the crossfire. He tried to duck out of the way and get to safety but a bullet had entered his leg causing traumatic injury to his left leg. He reached a hospital as soon as he could, but over time an infection set in and caused the need for his leg to be amputated.",accountant,Male
"He has practiced as a consultant and expert for more than 25 years. Dan’s experience includes time spent in Public Accounting and Corporate Finance where he served more than seven years in various senior leadership roles at a Fortune 100 company, including Director of Mergers and Acquisitions, and several subsidiary-level CFO positions. Dan is best known by his clients as an expert in litigation matters involving valuation and damages. He has provided expert testimony and damages analysis and consulting related to matters of fraud, material misrepresentation, intellectual property damages, solvency, shareholder dispute, property tax appeals, and contract disputes.",accountant,Male
"In 2010, he began keeping a list of every accountant mistake he observed, which ultimately turned into this book. In 2013, he received a significant promotion to corporate controller in part by employing concepts in this book.",accountant,Male
"He is a member of the American Institute of CPAs, Texas Society of CPAs, the Valley Regional Medical Center Board of Governors, and a member and past president of the Rotary Club of Brownsville. He is also past president of the Rio Grande Valley Chapter of the Texas Society of CPAs, past chair of the Southmost Regional Water Authority, and a past board member and chair of the Brownsville Public Utilities Board. In April 2012, Mr. Bradford was appointed chairman of the Texas Water Development Board. He has been married for 29 years to Leatrice Ann Bradford. They have two sons, Nick and Mitch.",accountant,Male
"He is a member of the American Institute of CPA's, New York Society of CPA's and the Network of Accountants. He is located just one block north of Old Country Road, within walking distance to ""Roosevelt Field Mall"".",accountant,Male
"Joined as a Accounting Consultant in Sattya but is eager to learn more about photography, documentaries, graphic designs, illustration and other media stuffs. She is energetic and loves music, reading and travelling.",accountant,Female
"In this capacity, Mr. Dow provided tax and business advice to rapidly growing companies and to private equity groups. He, therefore, has experience in merger and acquisition structuring, tax due diligence and sell-side transaction services. His other specialties include IRS dispute resolution, inventory and other accounting methods. His client base has primarily consisted of manufacturers, distributors, retailers and early stage technology companies. Mr. Dow provided advice to KV in the 1990's when Coopers & Lybrand served as KV's external auditors. He also served for three years on the Advisory Board of Bock Pharmacal, a branded pharmaceutical marketer specializing in women's health until the time of Bock's purchase by Sanofi.",accountant,Male
"Her firm, LR Robinson, LLC, is located in Tucker, GA and serves clients in the Atlanta Metro area. The firm specializes in working with small business and nonprofit clients. A graduate of the University of North Carolina at Greensboro, Lisa is an active member of the Georgia Society of Certified Public Accountants where she has served as Vice Chair of the Minority Issues Committee and is currently on the Leadership Council. Robinson is also a member of the American Institute of Certified Public Accounting.",accountant,Female
"She has specialized in tax advisory in the Corporate Tax group at one of the largest international accounting firms, with key clients in the Entertainment & Media, Technology, and Communications industries. During her years in public accounting, Hai Yan also gained extensive experience in audit and advisory services. Since then, she has held various management roles and obtained in-depth knowledge in financial reporting, internal audit, and corporate finance during her years in industry.",accountant,Female
"He is the owner and founder of Ohio CFO, LLC and is fully CPA certified. His priorities in life, however, are on health and fitness. He believes that life should be about being health and enjoying things, which is what builds resilience. While he has a tremendous directory of clients within his business for whom he prepares account statements and more, therefore, George S. Ammar always tries to offer them advice and tips on healthy living as well. This is because, above all else, he believes living a healthy lifestyle is actually surprisingly easy.",accountant,Male
"He has audit and accounting responsibilities for numerous commercial, ERISA and non-profit clients. His input in strategic planning, growth strategies, and expansion preparation has been critical to the proper governance and strategic growth of Bernie’s Book Bank.",accountant,Male
"Before that he worked with the Tanzania Chamber of Commerce, Industry and Agriculture and later with Total Tanzania Limited. He joined the TCME in July 2016 after serving as CEO of Resolute (Tanzania) Limited for two years. With Resolute, he",accountant,Male
"He has been involved in the investment banking industry and stockbroking industry for the past twenty five years. Prior to that, he was with KPMG, Chartered Accountants in Sydney. He is a member of the Australian Institute of Company Directors and is a member of the Audit Committee and Remuneration Committee. Appointed to the Board on 8 May 2000.",accountant,Male
"Sylvia thrives in an environment where she can drive change to achieve operational efficiencies as well as strengthen financial internal controls. Possessing an outgoing and enthusiastic personality and armed with best practices from product manufacturers such as Pfizer, Sony, and Universal Music, Sylvia has managed cross-functional teams and successfully implemented accounting practices and business process improvements that are feasible and effective, tailored to each unique business.",accountant,Female
"His practice is primarily related to Government Contract and construction accounting. While establishing his accounting practice, he was a full time assistant professor of accounting at Rutgers University. Prior to starting his practice, he was an auditor for the Defense Contract Audit Agency (DCAA), a Federal Government agency. During that time he was also an Instructor of accounting at Morris County and Bergen County Colleges. Agresto received his bachelor and master's degrees from Seton Hall University. He is accepted as an expert in the following judicial fora:",accountant,Male
"He has been with the firm for three years and has experience working on audits of private companies, employee benefit plans and not-for-profit organizations. Mike also has more than five years experience preparing federal, state, and local individual income tax returns. Mike received his Bachelor of Science degree in Accounting with honors from Villanova University. He has been a Certified Public Accountant in Pennsylvania since 2008. Mike is also a member of the Pennsylvania Institute of Certified Public Accountants.",accountant,Male
"After graduating in accounting from Brigham Young University, he worked for five years in Switzerland in both public and private accounting with several large international firms. Upon returning to his native Colorado, Brent found his niche working for smaller businesses in head finance and accounting positions where he could have a direct impact on an organization’s success. His extensive background includes working with companies in the service, manufacturing, healthcare and banking industries.",accountant,Male
"Plaintiffs assert that Anton's employment ceased in late 2004 or early 2005 and that he has served as an outside accounting consultant since that time. Defendants point out, however, that Barazi and Anton signed state liquor-license applications after 2005 and that the state liquor-license applications name Anton as a manager, managing officer, or managing agent.",accountant,Male
"He is Founder of Buy Rite Office Furniture and Restaurant Equipment, C.F.L. Custom Financing and Leasing Corporation, AMS Aviation Maintenance and Support Corporation, Winnipeg Blueprinting Company, Homes & Land Realty Corporation and Realty Zone of America Corporation. He is a Director on the Board of Directors for several corporations including Canadian Cooperative Implements Ltd., Superior Bus Manufacturing Ltd., Mediation Services and Manitoba Forward.",accountant,Male
"Prior to joining Centre Lane, Ms. Shapiro was a senior auditor at Deloitte focusing on financial services with a concentration in private equity. Ms. Shapiro graduated from Rutgers University with a Bachelor of Science in Accounting.",accountant,Female
"His responsibilities include accounts payable, accounts receivable, monthly reconciliations, data entry, assisting with quarterly and year-end reports, and assisting with budgeting and variance analysis.",accountant,Male
"Having commenced his career with the Unilever group under the ex-Vice Chairman of Unilever Worldwide, he moved on to consulted with affiliates of Spicer & Pegler and Price Waterhouse Coopers.",accountant,Male
Mrs. Ferguson is responsible for the day-to-day oversight of various municipal and school audit engagements throughout Bergen and Passaic Counties. Mrs. Ferguson received a Bachelor of Science Degree from Western Michigan University.,accountant,Female
"The firm was established in Massachusetts in 1979. They employ 7 people. Mr. Michael J. Cicoria is the Owner, and any questions or problems should be directed to his attention. This firm holds Massachusetts Board of Public Accountancy Certified Public Accountant License #5256.",accountant,Male
"The more the New York City-based planner looks at the new retirement product, the more she thinks CPAs are missing out on a potentially lucrative market.",accountant,Female
"Adam is a graduate of Illinois State University. He specializes in supporting the endeavors of investment banking firms in connection with debt restructuring transactions for public entities. Provides income tax services for individuals and corporations, QuickBooks and mybackoffice...",accountant,Male
Narine joined Syunik-Development NGO in the end of 2013. Her previous work included assistant accountant of Yeghegnadzor Gitelik University. Narine has a bachelor's degree in Economic and is currently pursuing her master degree at Yerevan Haybusak University.,accountant,Female
She now works in educating future accountants and dabbles with a side gig in photography. She squeezes this in between chasing her three small children around and keeping her marriage alive and well. The little blog that started out nearly four years ago as a means for her Mom to see her kids has turned into another part-time career in the land of the Internet.,accountant,Female
"He has operated his own Accounting practice for over 35 years. He also has an outstanding record of leadership and achievement in his corporate experience, having been Chief Financial Officer and Controller of publicly traded and privately held companies. He has experience in eight distinct industries, as well as, ""Big 4"" public accounting experience. He obtained his Bachelors of Science Degree in Accounting from LaSalle University.",accountant,Male
Before founding Control Capability he spent 25 years in the oil and gas industry working for international operating companies in senior group and operational finance roles. He has spent extensive time overseas in Africa and Asia as well as in the North Sea and European HQs.,accountant,Male
"He is a Management Consultant specializing in the Accounting and the Operations of the Manufacturing and the Processing Industries. He is a Board Member and the Treasurer of Islamic Foundation of Villa Park, IL.",accountant,Male
